<?xml version="1.0" encoding="UTF-8"?>
<components xmlns="http://www.osgi.org/xmlns/blueprint/v1.0.0"
	xmlns:xsi="http://www.w3.org/2001/XMLSchema-instance"
	xmlns:beans="http://www.springframework.org/schema/beans"
	xsi:schemaLocation="
		http://www.osgi.org/xmlns/blueprint/v1.0.0 http://www.osgi.org/xmlns/blueprint/v1.0.0/blueprint.xsd
		http://www.springframework.org/schema/beans http://www.springframework.org/schema/beans/spring-beans.xsd">


	<description>Type converters config</description>

	<type-converters>
		<component
			class="org.springframework.osgi.blueprint.config.TestComponentConverter" />
		<ref component="converterB" />
	</type-converters>

	<component id="converterB"
		class="org.springframework.osgi.blueprint.config.ComponentHolderConverter" />

	<component id="conversion" class="org.springframework.osgi.blueprint.TestComponent">
		<property name="propA">
			<value type="org.springframework.osgi.blueprint.TestComponent">sergey</value> 
		</property>
		<property name="propB">
			<value type="org.springframework.osgi.blueprint.config.ComponentHolder">rachmaninoff</value> 
		</property>
	</component>
</components>