<?xml version="1.0" encoding="UTF-8"?>

<components xmlns="http://www.osgi.org/xmlns/blueprint/v1.0.0"
	xmlns:xsi="http://www.w3.org/2001/XMLSchema-instance"
	xsi:schemaLocation="
		http://www.osgi.org/xmlns/blueprint/v1.0.0 http://www.osgi.org/xmlns/blueprint/v1.0.0/blueprint.xsd"
	default-init-method="init">

	<description>Configuration with sub-elements</description>


	<component id="char" class="java.lang.Character">
		<constructor-arg type="char" value="\u0000"/>
	</component>
	
	<component id="constructor-arg" class="java.lang.Integer">
		<description>description</description>
		<constructor-arg index="0" type="int" value="3" />
	</component>

	<component id="constructor-arg-ref" class="java.lang.String">
		<description>description2</description>
		<constructor-arg ref="constructor-arg" />
	</component>

	<component id="propertyValueInline" class="java.net.Socket">
		<property name="keepAlive" value="false" />
	</component>

	<component id="propertyValueRef" class="java.net.Socket">
		<property name="sendBufferSize" ref="constructor-arg" />
	</component>

	<component id="idref" class="java.lang.String">
		<constructor-arg>
			<idref component="constructor-arg" />
		</constructor-arg>
	</component>

	<component id="propertyValueNested" class="java.net.Socket">
		<property name="sendBufferSize">
			<component class="java.lang.Integer">
				<constructor-arg value="3" />
			</component>
		</property>
	</component>

	<component id="list"
		class="org.springframework.osgi.blueprint.TestComponent">
		<property name="propA">
			<description>ignored</description>
			<list>
				<value type="java.lang.String">value</value>
				<idref component="idref" />
				<null />
				<ref component="idref" />
			</list>
		</property>
	</component>

	<component id="listWDefaultType"
		class="org.springframework.osgi.blueprint.TestComponent">
		<property name="propA">
			<description>ignored</description>
			<list value-type="java.lang.Double">
                <value>0.0</value>
                <value>1.0</value>
			</list>
		</property>
	</component>

	<component id="set"
		class="org.springframework.osgi.blueprint.TestComponent">
		<property name="propA">
			<description>ignored</description>
			<set>
				<value type="java.lang.String">value</value>
				<idref component="idref" />
				<null />
				<ref component="idref" />
			</set>
		</property>

	</component>

	<component id="map"
		class="org.springframework.osgi.blueprint.TestComponent">
		<property name="propA">
			<map>
				<entry key="foo" value="bar" />
				<entry key-ref="list" value-ref="set" />
				<entry>
					<key><ref component="set"/></key>
					<ref component="list"/>
				</entry>
			</map>
		</property>
	</component>

	<component id="props"
		class="org.springframework.osgi.blueprint.TestComponent">
		<property name="propA">
			<props>
				<prop key="one">two</prop>
				<prop key="aero">smith</prop>
			</props>
		</property>
	</component>

	<component id="null" 
		class="org.springframework.osgi.blueprint.TestComponent">
		<property name="propA">
			<null/>
		</property>
	</component>
	
	<component id="compZeroLengthString" class="org.springframework.osgi.blueprint.TestComponent">
       <property name="propA" value=""/>
    </component> 
   
    <!-- 
	<component id="dateConstructor"
	 	class="org.springframework.osgi.blueprint.DateConstructor">
	 	<constructor-arg value="6/1/1999" type="java.util.Date"/> 
	</component>
	--> 
	
	<component id="nan" factory-method="valueOf" class="java.lang.Double">
       <constructor-arg value="NaN" type="double"/>
    </component>
    
    <component id="ambigousConstructor" class="org.springframework.osgi.blueprint.AmbigousTestComponent">
       <constructor-arg type="java.lang.String" value="compThreeArgOverride"/>
       <constructor-arg  type="java.lang.Object" value="true">
       </constructor-arg>
       <constructor-arg type="java.lang.String"><null/></constructor-arg>
    </component>
   
    <component id="nestedArgs" class="java.lang.Boolean">
	   <constructor-arg type="java.lang.String">
	   		<value type="java.lang.Boolean">true</value>
	   </constructor-arg>
	</component>

    <component id="nestedArgs2" class="java.lang.Boolean">
	   <constructor-arg type="boolean">
	   		<value>true</value>
	   </constructor-arg>
	</component>
    
    <component id="staticFactory" factory-method="staticMethod" class="org.springframework.osgi.blueprint.FactoryComponent">
       <constructor-arg value="String" index="1"/>
       <constructor-arg value="123" index="2"/>
       <constructor-arg value="981" index="0"/>
    </component>
   
</components>